comment_sum,content,create_time,dun_num,hot,jinghua,jubao_count,topic_id,zan_sum,label
1,做了很多看似叛逆的事情又不敢真的越界 玩又玩不来学又学不乖 还要承受被两拨人同时误解的命运惹,1716640289,0,96,0,0,0,0,1
10,以我考入尼采的实力，英语四级裸考是否可行,1718201126,1,1524,0,0,0,0,4
0,求刘静芳老师思辨与创新4.0开题报告，qq:2796452898,1714730937,0,28,0,0,0,0,3
3,错误的，消极的，倒错的，癔症的，蛇皮的，有慧根的，很挫的，前现代的，前反思的，1字头小宝宝的，自我享乐的，消费主义的，脱离现实的，脱离群众的，违反路线的，阳奉阴违的。,1721611248,0,256,0,0,0,0,2
0,投稿，研究生短期交换为什么附件提交不上去，有什么办法吗，看到有人成功了,1709111539,0,52,0,0,1,0,4
1,舍友半夜打呼噜到这个点睡不着。,1733338810,0,364,0,0,0,3,1
0,5b怎么有隔夜占座的啊啊啊😅,1732668404,0,111,0,0,0,0,2
4,嗟乎！时运不齐，命途多舛。冯唐易老，李广难封。屈贾谊于长沙，非无圣主；窜梁鸿于海曲，岂乏明时？所赖君子见机，达人知命。老当益壮，宁移白首之心？穷且益坚，不坠青云之志。酌贪泉而觉爽，处涸辙以犹欢。北海虽赊，扶摇可接；东隅已逝，桑榆非晚。孟尝高洁，空余报国之情；阮籍猖狂，岂效穷途之哭！,1720139398,0,519,0,0,0,8,0
3,外校朋友的朋友保研失败，紧急调转码头准备考上财金融专硕。替朋友来问问，上财金融专硕考研难吗？另外有偿咨询，如果有了解这个信息的学长学姐欢迎加v聊天，请喝奶茶的❤️vx：cc13600267285,1727774423,2,1594,0,0,2,1,4
7,如果有求偶哥的自信我做什么都能成功的😅,1727335102,0,1401,1,0,0,14,5
2,有没有毕业的学长学姐有闲置自行车或电瓶车低价出的～我们宿舍都要，求购2台电瓶车或者4辆自行车,1717809981,0,193,0,0,15,1,6
10,求问大家，孩子这样算是修满二课了嘛🥺😭😭为什么总分一直没加,1730598771,0,1002,0,0,0,0,1
0,tbh我一直觉得厌男or厌女本质和开地图炮的人没啥区别，个体极端案例明明一句sb都可以概括非要上升一个群体。爱女和爱男也是个伪命题，你连平等对待他人都做不到然后上来给自己扣个高帽说要爱女/男。唯物辩证法都给你们塞py里了是吧,1729573020,0,448,0,0,0,7,2
2,笑死，自己啥都不做还在那儿挑三拣四,1715135830,0,361,0,0,0,1,2
2,今晚注定要通宵了…根本学不会根本学不完啊啊啊啊啊,1719068336,0,474,0,0,0,1,1
19,有没有不想住学校的宝，女生（总是拒绝审核，想赚我💰😅）,1728571729,1,775,0,0,0,1,4
2,麻蛋淋了两天雨感觉要得关节炎了👍👎,1730462614,0,193,0,0,0,0,0
0,啊啊啊昨天夜晚点了个times贝果堡和咖啡，结果脑子不清醒没加糖也没加奶，喝到的第一口真是比我命都要苦啊啊啊啊啊，已经放弃喝它了😭🏳️🏳️,1729216597,1,127,0,0,0,1,1
2,跑了快300km了这个月，还有15km没记上。。校圈绝对没比我能跑的😡😡😡。我宣布我是上财刷锻王,1711891871,0,376,0,1,0,0,2
5,今天，哦不，玩校圈以来见到最抽象的话不是那个“女的最厌女”论了，而是那句震撼的“你要觉得异性恋委屈了你就同性恋”。不仅震撼于这句话，还震撼于发言者甚至毫无意识到这句话的恶意和对同性恋与异性恋共同的不尊重。同性恋和异性恋不是对方的替补或者安慰剂。“我尊重每一种性取向”，但“你要觉得异性恋委屈你就同性恋吧！”。,1718716494,0,649,0,0,0,1,2
4,讨厌早8,1710980612,0,346,0,0,0,0,2
5,急急急急急体育类社团管理层zhao人～二课🈵🈵，免锻等福利多多有意者速来联系！,1720956000,0,385,0,0,0,2,6
0,可💰 找人代写期末网页前后端作业  或者往届现成的也可以直接要 不要求做的多好 基本功能有就行 加v：Dmc17301835212,1715865121,0,22,0,0,0,0,3
4,今年的招生宣传写的不错哦,1719112328,1,1161,0,0,0,4,5
1,延毕要交学费吗,1728727635,2,276,0,0,0,1,4
0,有人把绿叶旁边毕业生宿舍底下别人借的推车推走快还回来，今晚不还回来明天早上立马查监控查到就不会好看了哦，那边楼下好几个监控你也敢偷我真是。。。,1719484314,0,264,0,0,0,0,2
1,昨天睡的太早没看到那个曲奇发疯，怎么会有人这么贱呢🤦🏼，拜托大家遇到这种人硬气一点，自己的利益是要自己守护的。遇到这种人真是倒了八辈子霉了…,1729733501,0,891,0,0,0,8,2
0,有偿求往年高代一试卷（什么院的都行，最好新一点）wx：15618753370,1734065423,1,49,0,0,0,0,3
1,chu周五林勇巴洛克音乐v：13011196057,1709185406,0,166,0,0,3,0,3
4,空中课堂每次暂停都会暗屏真的好烦,1732855226,0,634,0,0,0,8,2
12,水一下早日升五级💦,1720791302,0,145,0,0,0,1,6
4,菜砖毁了我的人生我一想到要考试，考试就会丢分，丢分就会输，输了就要花更多时间精力，就会每天没日没夜像个疯子机器只能考虑什么是有用的、拿什么来找补，而不是享受我的为数不多的大学生活。菜砖毁了我的人生，我毁了我自己的人生，一旦踏进来就无法拥有脱离和游离于这套体系之外的勇气。,1716899296,2,903,0,0,0,6,0
26,如何评价讨论学历歧视的置顶帖的帖主,1734691842,0,2665,0,2,0,1,4
4,瓦罗兰特怎么那么难打,1706780688,0,358,0,0,0,0,1
3,为什么一教好多插头都充不了电啊🤷🏻‍♀️,1734329555,0,279,0,0,0,0,4
2,电信校园卡可以申请移动的校园网吗,1727149414,0,291,0,0,1,0,4
1,失去人性，失去很多；失去兽性，失去全部。,1717669629,0,234,0,0,0,0,0
3,有没有申请了加州伯克利秋季访问项目的同学的群,1707829721,3,951,0,0,0,0,6
2,公主楼连续两天浴室出冷水了，生理期洗冷水，肚子已经要炸了，什么时候能管管,1727265985,0,406,1,0,0,14,1
0,🎉淘淘将于24号开店详情见公众号推文，内含必看注意事项‼️,1708489021,0,303,0,0,0,1,5
0,冬天裸睡好舒服☺️ ,1734479462,0,4,0,0,0,0,5
0,明天🈶偿借一个计算机🌷,1717392421,0,123,0,0,0,0,6
6,话说，我们学校是不是没有人玩阴阳师啊？感觉从来没在校圈刷到过，你鼠是真过气了吗😭,1714924565,0,372,0,0,0,0,1
1, 求解答 团课是一年一次还是一学期一次啊,1733974292,0,48,0,0,0,0,4
0,抽🚬的人能不能把🚬味散干净了再进教室不是人人都想吸二手🚬,1732586191,0,123,0,0,0,2,2
2,微经复习有什么建议吗,1718884820,6,502,0,0,0,1,4
1,想问问uu们有没有重度恋家的 然后在这边没有什么特别好的朋友 想交个朋友相互取暖🥺Q：3789388196,1709622128,0,355,0,0,7,3,0
2,商院外保到外校要排名百分之多少呢，看到朋友圈的学姐学长都好厉害，想给自己未来规划更清晰一点,1727591351,7,1032,0,0,0,2,6
2,好困，宿舍真是又凉快又舒服,1711781915,0,337,0,0,0,1,3
9,woc我怎么感觉我好像被当成骗子了🤡,1717430653,1,793,0,0,0,1,1
11,妈呀玩手机玩到有点无聊了水水水嗷嗷嗷,1727874741,0,256,0,0,0,2,3
0,概率论考试题型是什么呀,1729837473,8,96,0,0,0,0,4
13,在合生汇排两个小时了，好崩溃,1712204415,0,2421,0,0,0,0,0
25,新生可以发帖了吗在xsh刷到上财绩点政策改革了是怎么个事，会影响到24新生吗（仔细阅读发现看不懂一点orz,1721642032,0,1323,0,0,0,1,4
3,孙哲老师给分怎么样呀 怎么样才能在他的课上拿4.0呢（上的数据全球城市与发展 ）感谢各位老师,1726040759,0,529,0,0,0,1,6
0,有的滞涨连人家的话都没看懂，就开始写小作文抨击，蠢如猪,1730473924,0,148,0,0,0,3,2
1,千村返乡现在还可以改地点吗😭,1717070629,1,465,0,0,0,0,0
0,有些人其实是智障，但是因为生活还能自理所以一般看不出来。对这些人说话讲道理那就是在折磨你自己，直接骂就行,1733052464,0,3,0,0,0,0,2
0,想问问有下周二(29号)上午去安永面试的uu嘛我们可以一起拼车~v:15378900045,1729864606,1,160,0,0,0,0,6
2,大家的高瑜体育3网球都出了吗？为什么我一直差不到😭,1705026988,0,312,0,0,2,0,0
2,有没有宝宝近期可以一起去打耳洞的呀🥹🥹,1731734174,0,102,0,0,0,0,6
5,正确的标准流程：一般都上午10点以后，女的打扮打扮，男的取点钱，见面了，女的假装不好意思，男的一般都夸女的比照片好看，然后问女的爱吃啥，就领吃饭去了，男的开始展示自己的幽默，然后溜达，看电影，一晃一下午，女的也不说回家。男的寻思这是没跟我呆够啊，就说咱俩唱歌去吧，女的说太晚了，男的说没事，一会我送你回家。一般这阶段男的不会把女的咋地，这时候时间也有点晚了，男的说走吧我送你回家，女的还得寻思，这男的是没看上我啊，心里有点小失落，两人心里就开始寻思怎么能不回家。男的说这么晚了，你回家我也不放心啊，我有点没待够，女的说我必须得回家，男的说我送你，结果两人墨迹墨的10分钟没走几米。后来女的说我回不去家了，理由可能是寝室关门了，或者朋友对象回来了，男的一本正经的说，要不我给你找个宾馆吧，女的说，不过你得答应不碰我，男的说，放心吧，我不是坏人，然后微微一笑深藏功与名。然后两人就进宾馆了，先聊会天看会电视，男人时不时的说女的，你长的真好看，男的说，你明天还上班或者上学，早点睡吧，女的还得装不好意思，男的说我能抱着你睡么，什么也不干。女的说行，男的就狠狠的抱着女的说，亲爱的，我这么抱着你，你就不冷了，女的也抱上了，男的说我可以亲你吗，女的也默认了，可是一般这时候还不会发生啥。女的说行，男的就狠狠的抱着女的说，亲爱的，我这么抱着你，你就不冷了，女的也抱上了，男的说我可以亲你吗，女的也默认了，可是一般这时候还不会发生啥。这时候男的想有进一步的动作，开始脱女的衣服，脱到底线，女的这时候开始拒绝，推开这个男的，男的一看情行不行，就说宝贝对不起，我太冲动了，你要知道我是个男的，何况你还长的这么好看。女的这时候就把男的当亲人，讲述自己情路坎坷，人生迷茫，男的这时候就开始展现自己的温柔，宝贝你要是早遇见我就好了，一定不会让你吃这么多苦，你别怕，还有我呢。突破了女的的心灵防线，大家就都放的开了，女的开始亲男的，然后男的翻身小声说道：今天肯德基疯狂星期四谁请我吃？,1715252513,0,1225,0,0,2,1,5
2,暗恋一个人感觉自己好卑微，朋友圈被ta点赞都能开心好半天，虽然知道大概率只是单恋但还是不由自主地陷进去,1715264128,1,784,0,0,2,4,5
0,音乐美学与作品赏析怎么样,1709256683,1,90,0,0,0,0,3
0,有偿100r蹲一个留校的同学帮忙跑个腿，主要是帮忙拿表格去保卫处盖章并且寄这个表格，快递费我自己出，只需要跑一趟，只是目前具体哪天去盖章不确定，所以需要这周到下周都有空在学校的同学🥹🥹,1720582495,0,7,0,0,7,0,6
18,和男朋友一起 老是在掉眼泪 他好像也没感觉我真的很伤心或生气 轻而易举就用言语巧妙地“解决”了矛盾 自己比较内耗 怎么调理呢,1717084547,1,1213,0,0,0,2,0
4,大三上该选多少学分呀，才11分会不会太低了,1720070552,3,1209,0,0,0,1,4
1,法学院的怎么样😇😇😇😇,1720058094,2,447,0,0,0,0,5
7,李昌钰将要去交大，法医秦明刚去复旦🥹🥹🥹,1728698722,1,1021,0,0,0,0,6
3,真的很无语😓 今年哥哥因为上班没有回家过年，妈妈就那种什么也不想做 也不收拾家里，一点没有想到我已经两年没在家过过年了，好不容易回家过年就是这种，讨厌死了啊啊啊,1707487999,0,1195,0,0,0,0,2
4,无聊水一下,1724829046,0,99,0,0,0,0,3
0,30换70天小蓝车骑行卡,1729138881,0,0,0,0,0,0,3
3,刚用换季感冒请掉一节课就真的换季感冒了😥😥😥,1729084755,0,283,0,0,0,1,0
2,学校医务室有六味地黄丸吗？还有安眠药，最近熬夜熬多了，得补补,1729681994,0,265,0,0,0,0,3
3,无缘保研er在纠结考研or考公or就业or回老家躺平  想看看大家是怎么选的🥹🥹,1718559676,7,972,0,0,0,0,1
4,我换头像了，因为我是早八老师的粉丝,1712907298,0,535,0,0,0,2,5
10,看我们学校招生群的消息就感觉简直是见到了人类画饼技术的巅峰,1715864202,0,1354,0,0,0,5,1
3,周末在家熬大夜导致生物钟错乱现在巨精神🥲🥲🥲🥲🥲🥲🥲🥲🥲🥲🥲,1734288146,0,468,0,0,0,0,0
2,15r收韩景倜 金融科技导论往年期末试卷以及复习资料 +q2691345903,1734842634,0,72,0,0,0,0,3
1,有无李/许推制作人 换满赠或凑188满赠 目前已有两位分别124的周白推哈哈哈哈救救,1715745449,0,96,0,0,0,0,5
2,付时鸣的财报点名吗😢,1710287195,1,423,0,0,11,0,0
0,军训服都是一样的吗,1722578793,0,82,0,0,2,0,4
2,JJ20青岛排不到一点，准备冲厦门了。,1722315408,0,253,0,0,0,2,6
1,身份证丢了555  外地的  在上海补办麻烦吗,1710082564,1,285,0,0,0,0,1
1,宝宝，你真的好厉害呀，拥有糟糕的作息和惊人的食欲，还有易碎的身体，敏感的情绪还有空空的钱包，你到底是怎么做到的呢?读书，游戏，爱情，睡觉，赚钱都耽误，你是五条误吗😇😇,1734658080,0,210,0,0,0,2,1
6,所有很熟的聊天搭子里面 无论男生女生 最后一个单身狗今天终于脱单了然而我还没有脱单🤓,1723474418,1,630,0,0,0,2,1
1,运动会还放假啊？是哪天啊,1729216146,1,969,0,0,0,1,4
2,求问哥哥姐姐们 会计专业的同学不读硕士会对以后的晋升有影响吗🥺,1733737787,3,460,0,0,11,0,4
1,要蒸发了，好在过两天会稍微降点温,1720408094,1,82,0,0,0,0,6
3,半夜看美女跳高，结果看见蟑螂😭,1722794242,0,343,0,0,0,1,0
2,微观经济学陈旭东和严冬选哪个家人们,1704339663,1,220,0,0,0,0,4
0,接明天代刷锻代跑 几公里都行 给钱就行留联系方式俺加你～,1733411087,0,25,0,0,1,0,3
8,在上海有什么一人可以去玩的或者吃的吗,1727867730,5,813,0,0,0,1,3
2,跑步只剩最后26天啦。。。,1714191250,0,1036,0,0,0,0,6
7,自己平常物质欲望好低……属于有口饭吃有衣服穿就会很满足的……但是真的很想花钱但花不出去😭,1729226004,0,526,0,0,0,0,0
3,转专业不想转了的话 是去找教务处说吗 企业微信上让转的学院的老师私戳我没理我😢😢😢,1713679817,1,1303,0,0,0,0,0
0,感冒了明天测八百 求快点死掉教程,1730807990,0,145,0,0,0,0,0
3,图书馆一楼自习室为什么总有一个男生每天都时不时咳嗽啊。。。。,1732442701,0,432,0,0,0,0,4
1,四教每天晚上几点关门呀👀,1717945100,0,325,0,0,0,0,4
0,恋爱中感觉不够爱了怎么办,1715357426,0,22,0,0,0,0,1
0,高数老师你别太爱广义积分和无穷级数😀,1718089830,0,427,0,0,0,7,5
0,有没有五一留校的 想找人一起探店拍拍照啥的 qq：2802756410 我是女生 只找女生,1714530170,0,235,0,0,0,0,6
1,我的分身和帖子都回来了嘿嘿,1711729303,0,211,0,0,0,0,5
9,现有一枚可爱漂亮的小姐姐，某C9研一在读，有意谈一场轰轰烈烈的恋爱（有试用期和磨合期）要求身高在172—185，体重130—150之间，声音好听手好看，脸上干净不要有痘痘。各位有意向的好兄弟们速冲v：river010419（年龄不要太小，大三以上均可）,1707753906,0,1905,0,0,1,1,6
0,看到全在收课抢课的校圈感慨就要开学了哎,1708603232,0,456,0,0,0,2,1
0,apex打一把碰到一把暴力挂，求求这游戏快似了算了,1718412267,0,100,0,0,0,0,1
2,今天中午独自拥有了一整只烤鸭😋😋😋,1732252784,0,394,0,0,0,3,5
1,不懂就问，英语模块三可以不按照班级课表选课吗？,1718593590,1,373,0,0,11,0,4
2,在传统王牌大院百分之7成绩算高吗,1724048571,2,1390,0,0,0,0,4
5,所以这个座谈会只是装装样子，溜学生玩？😂,1719217683,2,1884,0,0,0,5,1
0,求青语绿艺的招新群,1727575933,1,22,0,0,2,0,6
0,现在招一个小助手，入职即可享云宝套盒大礼包一份！欢迎自荐推荐！简历投chenyuanying@huawei-partners.com（请备注“IoT开发者运营”）Base：深圳 坂田岗位：华为云IoT开发者运营（华为odc岗位）学历要求：统招本科（以下要求其实没有那么严格，欢迎来聊）[岗位职责]1、负责华为云loT平台的开发者运营工作，主要涉及内容、活动、产品、社区、用户等运营，打造华为云loT面向开发者的技术影响力。2、洞察开发者需求、行为分析，赋能开发者并能在各种开发者活动(如技术峰会，技术沙龙等)中与开发者进行交流。3、通过开发者调研，数据分析，开发者声音收集及反馈，推动产品体验及口碑提升，持续为产品提供有效的优化建议。[任职要求]1、有较强的沟通能力和学习能力，能把技术以易懂的方式解释给不同领域的开发者2、熟悉云计算、loT等领域技术和相关生态圈者，优先考虑3、有开发者社区、开源社区相关经验者优先考虑4、具有运营思维、策划思维，积极主动并具有高度责任感5、乐于接受新事物，自我驱动性强，有全局意识，对行业动态保持高度敏感,1710392233,0,6,0,0,0,0,3
3,东二门拿错超模厨房的人，如果你还没开动，可不可以把外卖换回来。。。,1733890728,0,337,0,0,0,0,4
0,有没有姐妹去虹口想搞编发的！可以来找我们哦~,1711118941,0,6,0,0,0,0,6
18,心转迷就像选购一样，你说什么他都要公示唱反调，然后咬你两口，还要装作理中客的样子，运用他学的一些知识来分析，以此凸显他的渊博,1724974959,1,2034,1,0,0,52,2
8,笨蛋求问：生产力与生产关系，经济基础与上层建筑的矛盾运动规律是哪个呀：决定、反作用or适应…促进，不适应…阻碍or两个都是呀？,1728991797,0,510,0,0,0,0,4
32,痒了自己拿拖鞋拍拍吧好吧我很少说话这么刻薄但是大半夜被吵醒我真的不爽到极点了,1720544938,1,1719,0,0,0,4,2
7,绷不住了我拿外卖走在路上听到背后俩哥们中间有一个人说《东方快车谋杀案》是斯卡蒂写的我走在前面疯狂憋笑。对不起哥们我知道不太厚道,1726978578,0,990,0,0,0,1,5
12,加油💪🏻,1734597308,1,834,0,0,0,2,5
41,今天亏死了1！2！3！跳！,1728472906,0,2674,0,0,0,2,0
0,就这个空调和冰咖啡爽,1722318369,0,108,0,0,0,1,5
4,抢到票了望周知🥰🥰,1713336917,0,927,0,0,0,2,5
4,三创赛求财会队友组队，这个项目是老项目 已有计划书ppt，现在需要相关专业同学改财务部分，报名截止日期是12月底，所以最近就得改出来🥺,1733312022,0,364,0,0,0,0,6
15,明天就去重庆旅游了，想问问重庆的友友们有没有常吃的火锅店推荐呀？如果有其他好吃的可以也推荐一下吗？谢谢！！！😃☺️,1711469575,0,790,0,0,0,0,6
0,拖家带口，还有台风普拉桑😅,1726452093,0,823,0,0,0,0,4
0,马勒戈壁小步点广告真烦，本来跑完就累死了一步一个广告跳转一步一个广告跳转,1711710482,0,7,0,0,0,0,2
1,请问当时上财门户默认密码是什么来着😢,1727748824,0,151,0,0,0,0,0
3,我的平板一个月要更新两次，每次我都没感觉到有什么改进啊，但是不更新他就会一直跳出来好烦,1731831064,0,198,0,0,0,0,1
0,感觉自己有点神经衰弱＋痴呆的前兆。。。刚要做的事情就忘了，忙忙碌碌发现自己又搞了一团乱子,1718499816,0,130,0,0,0,2,0
5,想入拍立得来个人劝退我如果不劝退的话推荐一下型号也行傻瓜一点的预算300-500,1728698643,1,408,0,0,0,0,6
0,天啦，怎么还有人在问红薯叔叔的事，我能理解各位的善良，但真的要保护好自己，不要被骗！不要被骗！不要被骗！有人被骗的话，我会怀疑咱们学校的整体智商😓,1716638921,5,361,1,0,1,14,1
3,班级里评的奖学金学院名单会公开嘛？,1720755924,3,1483,0,0,0,1,4
0,好像有点把中微的第六章和第七章搞起来了 怎么会这样 轻轻崩溃,1711543781,1,298,0,0,0,1,1
2,在面包店里买的有奶油夹心的牛角包，在空调屋里放到明天早上应该不会变质吧😢,1726240588,0,664,0,0,0,0,0
0,在宿舍骂别人一万遍，然后还不绝交还要每天舔着脸她互动…你真是活该被欺负,1730301993,0,1,0,0,0,0,2
2,大学毕业前有三段实习够了吗？顺便问问大家是坚持同一赛道完善storyline，还是在各种不一样的实习中选择职业方向的比较多呀？我总觉得干一行恨一行了😡,1706021699,14,2424,0,0,0,2,2
0,求一下竹笛社的招新群🥹+18612700166,1727157065,0,0,0,0,2,0,6
0,现在图书馆一楼M4的大哥，先来一套键盘CPU鼠标滚轮交响乐，再来耳机漏音r&amp;b。。希望把图书馆静音鼠标列入宇宙公约。。。,1712746911,0,93,0,0,7,1,2
12,懒牛牛的妈妈给懒牛牛发了六一红包，懒牛牛却很难受，因为懒牛牛并不像妈妈想象中的那么优秀努力，懒牛牛已经颓废了很长时间了，花钱很厉害而且很不听妈妈的话,1717224710,1,667,0,0,0,9,0
4,讨厌不出分数的老师,1720083811,1,703,0,0,0,1,2
3,周橙老师的西方经典音乐赏析明天上课会考听歌识曲吗？还是十六周再考,1734527772,0,363,0,0,2,0,6
5,新体育馆里有饮水机吗😢😢😢😢😢要渴死了,1717291485,0,432,0,0,0,0,0
1,还有同学捞大创队友吗，求捞,1705327291,0,538,0,0,0,0,6
0,踏进宿舍门一股死气袭来。。,1722436714,0,403,0,0,0,5,0
0,19号楼一楼半夜不睡觉在走廊摔东西（我相信你是不小心的）发出巨大声音&摔厕所门和宿舍门的人 我祝你每天都失眠到天亮,1731346269,0,7,0,0,0,0,2
1,今天是土 曜 日 吊在俊受亖吧！,1714182523,0,441,0,0,0,0,2
4,小姐姐你男朋友寒假跟前女友手牵手看电影哦😐,1709982959,3,1620,0,0,7,6,1
1,我这有点关于moxie的小道消息，加我说吧。半小时后删了,1729178605,0,568,0,0,0,0,6
0,这么凉爽的天气，为什么不让开窗透气!寝室里闷死了!,1728391919,0,9,0,0,0,1,2
1,推推科技创新与创业这门课事少人好分数好，平时讲讲创业案例，期末只有一个创业ppt，不点名，可以请假，给分很好,1725937191,1,82,0,0,0,0,5
4,求问韩元老师的摄影基础与图片赏析怎么样，期末怎么考核,1704433557,4,457,0,0,0,2,4
1,讨厌作息不规律的人,1718064882,1,372,0,0,0,5,2
0,现在运动会结束了吗，可以去刷段了吗,1730193094,3,63,0,0,0,0,6
2,新年快乐！,1704038697,0,190,0,0,0,5,5
0,临时突击复习好像打闪电战，只不过不知道是考试闪击你还是你闪击考试😪,1704166458,1,292,0,0,0,7,4
0,货拉拉能进校内吗,1718951656,0,7,0,0,0,0,4
4,公司金融挂了。,1705299506,1,448,0,0,0,1,0
4,中财王翼虹老师捞人么？🥺我感觉我一张卷子都写不上来三十分的题,1717063682,2,289,0,0,1,1,1
2,小情侣到教室自习能不能不要说话啊，就他们一对在哪儿嗡嗡嗡嗡的吵死了,1730293358,0,394,0,0,0,3,2
5,大家看到top3本的学生秀学历嘲讽心里会难受么😣今天刷到一个帖子 博主张口闭口“考不上fd导致的”“那fd怎么没把你招进去”心里好拧巴……,1709700683,2,1182,0,0,0,1,1
0,你说 想哭就弹琴 想起你就写信情绪来了不用太安静～,1725733010,0,39,0,0,0,0,0
0,找队友，雀巢ceo挑战赛2=3，希望你是擅长mkt相关ppt制作的队友~有意向做esg赛道题，如果有其他想法也可以讨论！如果不介意的话可以互换ppt看画片水平，联系方式：18302101223队友一：上财大四，曾参加过奥纬杯拿过top100和贝恩杯拿过优秀案例，雅思8，有头部券商行研+t2咨询+外企战略实习队友二：上外贸大三，绩点排名前5%，雅思7，有百事+新财富行研实习，案头研究和财务分析建模经验充足,1711353268,1,223,0,0,1,1,3
0,不要胆怯，不要退缩，不要放弃,1724855427,0,144,0,0,0,7,6
7,在尼采读书肯定会被三幻神恶心一下的，三幻神谁都不服谁～,1733045272,0,1755,0,0,0,9,2
2,健美操有没有想从文红为换成王珉的🥲🥺,1726117337,0,387,0,0,0,0,0
2,马原问答分差一分对最终成绩影响大吗 实在懒得刷了,1734018348,1,1099,0,0,0,0,1
2,特别鸣谢糖葫芦 已经五级了🥹🤞,1728099391,0,180,0,0,0,4,5
4,现在还是不太懂大创这玩意到底有什么用？结项了但是感觉没有任何收获，如果目标外保的话能通过大创写出一篇不错的参营论文吗？有没有必要参加这学期的大创？我自己金院大二，如果有必要的话应该选择什么方向的题目呢，我大一选的是纯社科类课题，不想再做这方面课题了觉得有些无聊，信院课题和金院课题的方向适合作为参营论文的方向吗，自己数模国赛得过市奖，能否有学长学姐回答一下？谢谢！,1704977702,44,2409,0,0,0,2,4
9,为什么辅助可以转到一专，交换就不能。凭什么,1720495520,4,1153,0,0,0,0,4
0,有没有同学有学籍科的邮箱呀？球球,1709173644,0,40,0,0,0,0,4
0,校友忘带身份证了还能进得去校门吗🥹🥹,1727232973,0,49,0,0,0,0,0
