comment_sum,content,create_time,dun_num,hot,jinghua,jubao_count,topic_id,zan_sum,label
3,想问一下是不是被骗了，前段时间在一个家教群里接了一个家教单，最后没有试课成功，那个对接老师认为是我的问题导致失败拒绝退信息费，但是具体情况是这样的：我接单子的时候平台发的是可以线上，然后我交了信息费，后来对接老师告诉我家长想线下，让我自己沟通，沟通的时候家长和我说不想线上了，以后再说，等我开学回来联系她的时候我就被拉黑了，所以我想问一下这也是属于我的问题吗？我觉得是这个家长她临时改变主意啊，还是说这是一个彻头彻尾的骗局，孩子碎了,1725447334,1,1077,0,0,0,3,1
3,希望未来能过上幸福的生活,1735194419,0,76,0,0,0,3,6
5,妈耶，从n人变成s人了，现在是职场最爱的mbti……这算是被磨平棱角了嘛😢,1714903450,1,472,0,0,0,1,0
0,诚招soyorin一位,1725810454,0,0,0,0,0,0,6
7,期末小蝴蝶要忙到起飞了。。。😿,1734619897,0,480,0,0,0,3,0
9,提前退休！！！感谢老师的打赏！提前退休的感觉太棒了！！！,1728717013,0,925,0,0,0,4,5
8,想问问符豪的毛概有小组作业pre什么的吗,1719571229,0,457,0,0,0,1,4
1,友友们，你们觉得应该帮别人占位置吗？今天帮朋友占位置，快上课了朋友还是没有来，好多人来问但是我只能说有人有人，感觉好尴尬啊。,1734065405,0,736,0,0,0,1,1
4,大一军训是在什么时候啊，暑假能有三个月嘛，想放假了,1714972754,0,874,0,0,0,0,6
2,有没有好心人在三教看到一个没有笔帽的apple pencil😭原来只是笔帽丢了 现在连笔都丢了 想鼠,1712106425,1,150,0,0,0,0,0
4,定点面试成功的话什么时候会通知时间？如果时间冲突了可以退出吧🥺,1715155074,2,781,0,0,0,0,6
7,想问问上海本地的同学，家长车不能开进学校，那开学放假的时候床垫被子啥的是纯靠自己和家长搬进学校吗，有没有方便一点的办法，如果不把床垫带回家又怕发霉😭😭😭因为猜测外地同学放假床垫被子就放学校了，或者直接寄回家，应该没有这个烦恼）,1723956739,0,991,0,0,0,0,0
0,球球好心人填填问卷～～30秒即可🥹蟹蟹蟹蟹祝大家门门满绩！,1714276514,0,36,0,0,0,0,5
0,dd出书及资料,1704441635,0,76,0,0,3,0,3
0,出叶伟春金融机构金融市场期末试卷 25一份vx：recovery_k1011,1709530531,0,4,0,0,0,0,3
0,有出拍立得的吗，想收一个,1722913729,1,162,0,0,0,0,6
3,所以上海市学生运动会的志愿者选完了嘛😥,1726292691,0,1155,0,0,1,1,0
2,摆拍姐点菜姐鼠了🙄,1724978617,1,853,0,0,1,6,2
0,找可以教wxh老师的货银作业的。q：3021826546,1711592438,0,18,0,0,0,0,3
0,经院数分3只想过的话需要速成哪些内容求各位好心人指一条生路😭😭😭,1704168772,7,355,0,0,0,1,0
0,大家帮忙填填问卷🙏🏻祝大家期末门门4.0🌸,1731914061,0,159,0,0,0,1,5
1,想问一下淘淘什么时候开门？什么时候可以去买书？,1707210733,5,280,0,0,0,0,6
0,收以下书,1725785167,0,238,0,0,0,0,3
0,急急急！现在速求讲座代签到！！！女生➕530115424,1715757081,0,15,0,0,2,0,6
20,完了这jgj一点也不会怎么办🤡🤡🤡,1713711243,0,1630,0,0,0,7,1
4,我性格：一会是天塌下来我崩溃硬撑结果发现天摸起来还挺舒服的然后自顾自开心一会是因为呼吸的空气里二氧化碳多了就气晕,1725986983,0,492,0,0,0,5,5
12,大学路有啥必吃的餐厅吗？,1727769608,3,1357,0,0,0,1,6
0,原来站起来拖凳子没有声音啊，每天发出那么大拖凳子噪声的屁股粘凳子上了啊,1735100650,0,90,0,0,0,0,2
1,有偿20r寻找朋友周一帮送一份档案到统管学院教学楼，v:19860981293,1717300444,0,369,0,0,2,0,3
6,我的兴趣爱好是睡觉，我的人生追求是睡觉，我没有远大的理想，我只想每天都能睡很香的觉，上学没有睡觉重要，赚钱没有睡觉重要，吃饭没有睡觉重要，不过如果饿得睡不着了还是要吃一下的，总之我的一切奋斗目标都是为了睡觉,1711589012,0,349,0,0,0,14,3
16,我就是煎荷包蛋的神！还有谁能像我一样煎出外边缘焦香脆脆的，但里面还是糖心的荷包蛋！好吃得要晕过去了,1721818547,0,679,0,0,0,7,5
4,平板怎么连校园网🥹🥹求求,1724051048,0,274,0,0,0,1,1
0,开心一点,1716197981,0,180,0,0,0,2,5
3,做一件事就是要做好它没有结果的准备,1717947981,0,229,0,0,0,2,1
4,救救我…新苑夜宵炒饭怎么会这么难吃…怎么是用酱油炒的…家里蛋炒饭都是鸡蛋加葱花…,1709644145,0,903,0,0,0,3,2
1,收上几个学期ryc会计信息系统3.7/4.0的access作业，孩子不会做仅参考😭,1735113176,0,72,0,0,0,0,0
0,有偿求近纲思修选择题题库QQ：3195024981,1717895357,0,67,0,0,0,0,3
7,为什么我每天上班+运动这么累，你们每天都有可乐要买，有意思咩👿,1720432739,0,1006,0,0,0,1,2
2,想去攀岩 但打开美团看了两百多价格轻轻地碎了,1717591680,1,457,0,0,0,0,1
0,租个男朋友（仅拍个合照，发个朋友圈就行）帅点的，能让我一眼就自卑，让前男友一眼就自愧不如的那种,1726987134,0,7,0,0,0,0,6
1,暑期交换项目一般都是大几去啊？申请的时候有什么要注意的吗？感觉现在什么都不懂啊,1711720103,10,894,0,0,11,1,4
4,想知道我们学校有保研去对外经贸或者央财的嘛（sufe你研究生学费真的太贵啦）,1729517528,5,1593,0,0,0,1,6
3,新生买床帘下铺尺寸85*195，想买一体式床帘，但是网上没有这个尺寸的，该怎么买啊？床垫尺寸是不是必须小于等于床帘尺寸？,1724329450,0,463,0,0,2,0,4
4,有时候感觉自己挺窝囊的，做什么事情都要瞻前顾后考虑很多，没有年轻人不顾后果的热情和勇气。像个老头子。,1733331584,0,307,0,0,0,3,0
7,相比之后的课程数分是不是还算简单的……然而我还是学不会😢😢,1719156299,2,745,0,0,0,1,0
2,英语三大二上不想学英语了，可是外语又与专业课冲突，能不能以后再学,1720070771,0,313,0,0,0,0,1
0,纹理感拿捏男生氛围感烫发的神啊啊放假直接安排，联系了好多学校附近的店，来了推荐最多的一家男士店，在大学路上真的是隐藏在巷子里的宝藏！我是昨天下午烫的！服务特好 也挺满意的今天舍友就过去了/敲敲,1734502003,0,124,0,0,0,0,5
1,困死了…😡,1726622722,0,48,0,0,0,0,2
6,刚刚拍的中秋的月亮，㊗️大家中秋快乐，顺利找到理想工作🥳,1726577557,0,814,1,0,0,16,5
4,为什么我明天还有一堆课（啊啊啊啊啊）,1714368656,0,246,0,0,0,0,1
4,学校有修电脑的地方吗？求！ 或者周围有哪里可以修电脑吗😭,1712898660,1,232,0,0,0,0,0
3,谁还记得爱情开始变化的时候😭,1720354618,1,855,0,0,0,5,0
4,政治经济学期末是闭卷还是开卷呀？,1732283745,0,433,0,0,0,0,4
0,由于本人于8.27号在香菜哥评论区稍微带了一点攻击性 香菜哥光顾了我的dy主页 望周知😃,1725243098,0,456,0,0,0,0,5
7,在寝室刷牙的人我不尊重不理解然后祝你早日牙掉光。,1732291026,0,1522,0,0,0,4,2
3,周冏马原出分了吗？给分如何？,1705542182,2,1104,0,0,0,0,4
3,有人知道刀疤去哪儿了嘛，好几天没看见它了🥺,1716298040,0,465,0,0,0,0,0
0,jrm提问一下有什么蛋糕好吃而且夹心多呀😍😍最近超级想吃蛋糕🍰,1734519301,2,129,0,0,0,0,5
0,好烦。明天不想跑800不想考试,1730904155,0,70,0,0,0,2,1
12,二外建议选日语吗（虽然特别喜欢看动漫，但好像有基础的人特别多..,1718259434,3,1815,0,0,0,0,4
2,#大创求问  是保存了就算申请上了吗？老师那边就能看见嘛,1705416067,3,1092,0,0,0,1,4
8,没人像高中应试那样给我听写单词真的背不了多少单词，我都有点想找人给我听写单词，听写错太多就惩罚我了、、我就是自学能力为0的飞舞东西、、,1709562138,1,765,0,0,0,1,1
6,想和心选哥做很久的好朋友😭,1730473052,3,670,0,0,0,0,0
1,图书馆二楼啥时候延时呀？不想去一楼，感觉一楼好冷,1734184632,3,655,0,0,0,1,6
6,我们学校有哪些专业算工科哇,1717553429,0,840,0,0,0,0,4
2,菜鸟已经名存实亡了,1716437248,1,1629,0,0,0,7,1
4,周末就考了个六级，考之前和考完都在睡觉，时间都没了，死耗脑子怎么一天天就想着睡觉，快起来干活啊啊啊,1734227055,1,955,0,0,0,7,1
0,胡运权教材错太多了吧,1719050940,1,142,0,0,0,0,1
8,我爸只有不出现在我眼前的时候才是好爸爸，一出现就很烦,1722824188,0,564,0,0,0,5,2
8,你财虽然行业没以前好，但罪不至此跌这么狠吧，难道985分数高是因为财经类专业比我们就业好很多吗,1721387002,2,1996,0,0,0,4,1
4,遇e变i 遇i变e 🌝🌝🌝,1726114731,0,292,0,0,0,6,5
2,平静就是快乐,1721139925,0,174,0,0,0,1,3
3,请大家不要在教室而且是人很密集的教室吃带馅的东西可以吗😶‍🌫️,1729727981,0,693,0,0,0,3,2
4,做梦 梦见和高中的同桌待在一起 那个时候我们还是最亲密无间的搭子 她还没有去北大读计算机 我至今仍然不知道我是不是喜欢过她 我不想当人人喊打的双性恋 但是我好像已经是了（）,1720847500,1,684,0,0,0,3,0
11,已经查到分了 713，清华和北大的招生电话已经响了一整天了，我妈问我想选哪个。我说我想上上海财经大学，我妈扇了我一巴掌。我不服，我反手掏出来&quot;厚德博学，经济匡时”八个大字，上海财经大学校训八个字在微弱的灯下显得熠熠发光。我哭了，我妈也哭了。她说，她这一辈子从来没有见过如此振人肺腑的校训，镌刻在心里般地难忘。她紧紧握着我的手说，孩子，这18年来你选择了很多错误而曲折路，但是这次 是你人生是转折点，你选择了一条无比正确而闪光的路。你长大了，孩子！转身，她给清华北大招生办接连打去电话。面对那边的翘首以盼，她仅仅回了四个字“你们不配”。,1717844989,0,2323,1,0,0,16,5
8,为什么青橘单车没锁车，才过10分钟也能被人直接扫走啊。服了服了。学校青橘本来就少啊。我目前觉得青橘性价比绝了，车相对新，而且学期卡120天只要10块一个月哈哈哈哈。滴滴给我打钱。,1725268198,0,516,0,0,0,1,1
0,公司金融怎么学，应该做什么题目啊,1728905118,6,111,0,0,0,0,4
0,上财有没有户外社团的迎新群,1723520702,0,63,0,0,1,0,6
8,想找180有腹肌不抽烟男大tla👉🏻👈🏻,1728315219,1,886,0,0,0,0,6
1,宝宝们😿 学生证丢了应该怎么补办呀,1704159314,1,451,0,0,0,0,0
30,惊觉自己现在享受社交大于享受独处了，我已水灵灵变为e人,1723225623,0,1347,0,0,0,6,5
4,做考公题有一种幸福的感觉,1716188498,4,1068,0,0,0,1,5
0,高价球王鲁峰心理社会与生活往年考卷,1734515928,0,66,0,0,15,0,3
10,这学期比之前进步了好多，虽然远比不上那些3.7，3.9的同学，看不出是不是绩点改革的受益，但已经明显进步了好多！这是我努力了一学期应得的😤,1720094862,0,1726,0,0,0,7,5
1,我真不理解为什么有人这么想让别人痛苦，难道别人不开心能让你开心起来吗,1726827862,1,324,0,0,0,3,2
2,突然想起来自己还考过普通话，什么时候出成绩啊都已经过25个工作日了,1714010717,0,727,0,0,0,1,4
2,空谷笛社参加明天的百团大战嘛 怎么好像没有看到😳😳,1727071459,0,337,0,0,0,1,4
0,找兼职继任,1721129436,0,10,0,0,0,0,3
10,如果以后想去银行工作，应该在大学期间找什么实习？,1705366494,5,1719,0,0,0,0,6
0,开学补刷锻可以跳绳补吗,1725681818,0,130,0,0,0,0,4
1,一营女教官是排长？好厉害,1724494430,0,1653,0,0,0,2,5
0,想做家教的可以进群~很靠谱,1732781576,0,6,0,0,0,0,3
6,各位CPA一年考哪几科呀,1708844751,1,495,0,0,0,0,3
5,一段感情让人觉得没有任何灵魂上的共鸣还有必要在一起吗,1731254621,1,708,0,0,0,0,1
9,到点了就想e但是最近好像光顾着忙没怎么时间为自己感到难过有没有还没睡的人愿意和我聊聊你在e什么,1711302966,0,309,0,0,0,0,0
0,晚了，但发,1712912253,0,289,0,0,0,0,1
0,中财把我害死了、、,1718458551,0,171,0,0,0,4,0
3,collocation咋复习啊,1731723320,0,510,0,0,0,0,4
2,二课成绩有最高限制吗🤔,1734244899,0,1032,0,0,0,0,4
0,sd卡的外壳坏了一点导致数据读取不了了😭学校附近有能修复的地方吗？😭,1713177454,0,48,0,0,0,0,0
2,玉玉了，每天什么都不想干，男朋友让我有点意志力，强迫自己早睡早起，真想揍他😅,1711002089,0,591,0,0,0,0,0
4,为什么有些xql老要在很多人都在自习的地方用气声讲讲讲 不自习不可以去外面吗一定要在自习教室交流吗🥺,1717825631,1,970,0,0,0,7,2
4,想问问大家 图书馆自习的地方哪些需要预约啊 苯人来的有点少🥺,1714628951,1,705,0,0,2,1,4
10,看到卖课的就想去教务处举报不上就退了呗，真恶心,1704280377,1,2122,0,0,0,6,2
5,接老鼠药推广，有吞咽镜头不催吐,1719479279,0,649,0,0,0,2,2
2,放假就是爽，退圈一段时间,1720948177,0,136,0,0,0,0,5
2,先问问大家 大英赛过了初赛 这个时候拿的一二三等奖 是上海市的还是全国的啊,1709773341,5,651,0,0,0,0,4
2,收西方文化入门笔记和往年试卷,1734873055,0,234,0,0,0,0,3
8,被绿叶中午的韭菜炒鱿鱼侵犯到了🔥,1728707655,0,642,0,0,0,2,2
0,为什么我还有三科没出，给个痛快吧（哽咽）,1720056826,1,199,0,0,0,2,1
0,出 习近平新时代中国特色社会主义思想概论 电子版教材 高清PDF vx:19802117148,1716349162,0,70,0,0,1,0,3
4,小手办引体向上太帅咯,1725019171,1,1428,1,0,0,17,5
0,学校理发店怎么样啊 想染发 做巴黎画染,1709864169,1,217,0,0,0,0,6
5,坐图书馆一下午写了5道题，被自己气笑了😅😅😅,1716037101,3,1032,0,0,0,2,5
0,问问邹欢的python2 会挂人吗,1734687302,7,70,0,0,0,1,4
5,我就说读书有用！图书馆遇到crush了！！！啊啊啊啊我疯了！！！,1730175109,1,1438,0,0,0,3,5
1,家里的新房子没有我的房间好崩溃,1725191994,1,454,0,0,0,0,0
0,📣普华永道X 上海财经大学📣🚀12/9 宣讲会 18:30 大活301🚀12/12 校园校招Superday面试👉23-25届本硕同学欢迎投递秋招❗️👉26届及低年级友友们可以投递冬季实习生计划❗️,1733321623,0,0,0,0,0,0,3
4,好奇一下咱们校医院报销比例有多大？会说一百多块钱的药只用付几块钱吗？,1720769069,0,636,0,0,0,0,4
0,有偿求形策老师划的重点,1715869574,0,178,0,0,0,0,6
0,8号早上六点虹桥机场，有拼车的吗,1707025652,0,159,0,0,0,0,3
0,又到了每日睡不着翻相册时间了 看到一张张照片好幸福 以后要多记录！,1717084893,0,88,0,0,0,0,5
0,转会院的笔试 数学和英语分别有什么题型 大概什么时候考试,1711680654,3,421,0,0,0,1,4
0,快快结束吧我要出去旅游😼,1725168796,0,49,0,0,0,2,6
2,28°空调一直强风呼呼的开着，真的不觉得燥热么？我是真的现在受不了,1734886611,0,648,0,0,2,2,2
105,家人们！祝我4级啊啊啊啊啊😭呜呜呜差你啦！,1713089762,0,1302,1,0,0,10,6
4,锐评这个ai转述都影响理解了，都说了堆什么玩意👊👊👊,1718627378,0,654,0,0,0,2,2
6,但是我们的两财😃没问题啊两财😋没人能碰瓷两财🤣我们的两财还在赢 😏高考志愿的第一手pick永远是这两个财专！😆第三个来了！第三个来了！😄两财一贸 我们仨 ！🥳🥳🥳保住三兄弟！🥳🥳🥳保住我们哥仨🥳🥳🥳华五你吃得住两财一贸的招生吗？击穿中九😎上财在985里游泳😝哎，出分数线辣！要小心下滑😦上财被工科985挤下来了😰而且多省低于北邮西电要被薄纱了😱😱😱而且新热门人工智能也已经续上了😩😩😩而且这样北京财贸没有张雪峰也不好走，增开几个双学位能阻止分数线狂跌吗好像阻止不了😭😭😭😭😭😭哇~山川吉的这波分数线涨的太要命了😨哇😨哇😨,1720093549,0,2122,1,0,0,13,5
0,收计算器,1714353060,0,37,0,0,0,0,3
0,十四天之后我照样抱怨啊孩子,1725238525,0,211,1,0,0,14,1
3,各位学长学姐 紧急求助上财校园网cmcc的那个账号密码是什么呀？和学生网络自助服务中申请的卡号和密码是同一个吗？😭,1725709002,0,490,0,0,0,1,0
0,北菜鸟 南韵达刚取完快递 怎么这么远啊啊啊啊啊,1717988663,0,60,0,0,0,1,1
0,有偿帮开假条请假,1718340507,0,21,0,0,5,0,3
1,高价收3.7+企业经营探秘中期报告讲稿及ppt,1712837321,0,309,0,0,0,0,3
11,我是人面猪，中间忘了，反正就是很能吃。你敢惹我，我就吃光你的饭,1728110440,0,460,1,0,0,10,2
0,探索自己是一生的课题,1717955965,0,96,0,0,0,0,3
4,尼采的菜鸟驿站就是坨屎,1725450416,0,579,0,0,0,4,2
35,大家一个月生活费大概是多少哇,1716092421,6,4732,0,0,0,1,3
0,统院概率论期末会不会来一些容斥公式的应用的选填啊,1733584826,5,61,0,0,0,3,4
8,感觉24届新生要汗流浃背了哈哈哈哈哈哈……还没进学校自己多少位次什么层次学长学姐都知道了,1721542814,2,2295,0,0,0,2,5
5,其实有很多路都有人行道（比如武东路操场旁去三教的路，比如原教材中心门口的路），但高峰时期还是很少有人选择走。如果说学校大部分路是受条件制约无法实现人车分流，这几条路明明可以人车分流，却还是无法实现，挺悲哀的,1726046529,0,688,0,0,0,6,0
4,为什么给教务处打电话全是空号，是因为不在学校吗,1704766582,0,990,0,0,0,0,4
0,有没有在台湾政治大学交换过的学长学姐，想请教一下问题，有偿+v18816919273,1708479105,0,4,0,0,0,0,6
0,我会诅咒食堂，没见过这么不要脸的,1729160079,0,136,0,0,0,3,2
7,求电视剧推荐宝宝们,1727789758,1,385,0,0,0,1,6
0,求往年《鬼谷子》期末4.0论文，不抄袭只参考字数和格式，💰你定vx：18735125151,1717496871,0,13,0,0,0,0,6
2,李挺的会计学和刘方舟的公司金融（选修）都是英语的吗😢,1718944505,0,466,0,0,0,0,0
3,发一条几个烟花,1704935918,0,288,0,0,0,0,5
2,出经管机期末试卷以及练习卷多套，还有数分一期末试卷，数分三高代期末试卷，概率论期末试卷，用于期末查缺补漏，亲测有效。QQ:3970902271,1732522184,0,138,0,0,0,0,3
0,求统院回归分析往年期末卷，qq:3524373938,1731635799,0,54,0,0,0,0,3
1,大二啥时候开始选课,1733991693,2,490,0,0,0,0,4
5,色戒看得我好生气,1735289231,2,1065,0,0,0,5,2
0,好饿啊。。。,1727715208,0,21,0,0,0,0,1
2,平谷有线和pods二代耳机相比，哪个音质更好些呀,1712031565,0,150,0,0,0,0,4
0,帮补锻明天还可最后80km,1709035669,0,96,0,0,0,0,6
1,图书馆没素质的能不能别去？一直大声叹气，用力放笔，快速划动鼠标，走的时候直接拔充电线导致插头砸桌上发出声音。你是不知道图书馆应该尽量安静还是没人教你？😅😅,1732457992,0,282,0,0,0,4,2
4,您猜怎么着 第五人格维护到九点半,1720051691,0,634,0,0,0,3,4
23,高数没及格的来这集合✌️,1714985080,2,3070,0,0,0,2,5
0,捞一个d5混锻队友 二阶及以上屠或者求生者都行🤗,1726150600,0,90,0,0,0,0,5
0,出周一11-12肖升生数据挖掘与探秘周四早八金融计量学,1719975560,0,13,0,0,0,0,3
3,tsg别去了人太多，给我挤回国定了,1732346595,1,2464,0,0,0,2,1
6,人在跑步 足球五分中内硬是从头边飞过三次还躲过了😇,1732105309,0,550,0,0,0,3,5
0,求拉泳协群,1709787786,0,115,0,0,2,0,6
0,湖南高院退彩礼，60个一分不退，这应该按zp来办的事情结果当成婚姻财产纠纷,1715390171,0,13,0,0,0,0,1
0,计算机组成原理这本书需要用教材吗？,1725848153,1,51,0,0,0,0,4
8,如果pdd怀孕的话 那些cpdd的都跑不掉😡,1729531062,0,1458,1,0,0,14,2
3,高数76期末要多少分才能4.0😭,1731838730,1,1585,0,0,0,1,0
2,一个人可以加入两个部门吗,1726306249,0,423,0,0,0,1,4
0,收:新一代大学德语1   赵劲价格可议,1725423749,0,117,0,0,0,0,3
2,初五情人节，异地的该怎么过呢？ 还有，买什么礼物送npy呢？预算200-300,1707745297,1,997,0,0,2,0,6
4,问下上过李成龙老师的走进康德和黑格尔这门课的同学，这门课期末怎么考核,1719806470,0,502,0,0,0,0,3
13,第一段实习去腰部券商做行研怎么样？,1730611153,8,1284,0,0,0,4,6
1,大英期末也在期中那个大机房考吗,1734241534,0,468,0,0,0,0,4
9,求其期末考试不写论文的选修课和限选课,1720496402,5,820,0,0,0,0,6
0,收马原慕课答案,1709549911,0,3,0,0,0,0,3
5,啊啊啊我真的好讨厌小组作业和实践作业😿😿😿😿总有莫名其妙的责任感 总要假装开朗。。其实我是一个阴暗b我什么话都不想说什么感想都不想发表😿😿😿讨厌讨厌讨厌呜呜呜😭,1729057129,0,604,0,0,1,7,2
0,天上也在改造水管吗 又是钻地又是漏水的👿,1718946151,0,72,0,0,0,0,2
4,现实太痛苦，还是来校圈混比较快乐。,1707797367,0,667,0,0,0,2,5
0,周波的管理会计怎么复习啊😭不知道上课在讲什么，讲的case也云里雾里😭😭,1714119738,2,157,0,0,0,1,0
6,提前问问济州岛的旅游攻略🥹准备明年春夏去😼预算3k左右？（maybe）,1732805362,3,597,0,0,0,1,6
1,商院中微期末难度是大于钟根元还是小于😢,1718627731,1,439,0,0,0,1,0
2,一想到明天要上早八我就…,1710258516,0,328,0,0,0,3,0
4,好想关心你，但你总不生病,1721001994,0,549,0,0,0,3,6
2,哪里的歌声,1716203074,0,379,0,0,0,1,4
0,校友领航活动是什么情况,1709805796,16,271,0,0,0,0,4
10,？5级了,1723624088,0,190,0,0,0,1,4
15,为啥我还有一门课没出分，个人外事绩点和排名也都没更新，搞什么鬼，还出不出了,1720689952,1,2035,0,0,0,2,1
1,一天不学没手感了三天不学忘一半了五天不学全忘光了七天不学不会学了,1728349140,0,556,1,0,0,13,1
1,到底是有多逆天和没有生活常识的人才会把方便面残渣倒进壁挂便池里面。。。。,1709648340,0,610,0,0,0,2,2
3,我在在阳台晒衣服的挑战中取得了满头大汗的好成绩 你也快来试试吧,1726198750,0,426,0,0,0,4,5
0,求代课 今天晚上七点五十到九点半 只要签到,1731925411,0,223,0,0,14,0,3
4,捐旧衣的活动什么时候、在哪开始啊,1731564554,1,303,0,0,0,0,6
35,这个点没睡着的人都在干嘛呢😋,1717956127,0,1485,0,0,0,1,5
2,已玩贪吃蛇大作战成魔。,1705648539,0,405,0,0,0,1,5
6,有时候真的很讨厌当前的这种集体宿舍制度（注意不是宿舍制度），制造很多无谓的麻烦，让人消耗很多本不必要消耗的精力。我不是要求别人做圣人，但有人真的是连最基本的公德都做不好啊，提醒了十遍二十遍也不带改的。今天朋友跟我发他们学校又有人抱怨balabala了，我说其实我就是觉得这个制度最恼火，做个背调再分寝都能少很多麻烦。当然我说的没公德心的这种情况我真不知道怎么解释和解决了。或许原理类似大智障生小智障吧。,1728966836,0,999,0,0,0,9,2
0,关注了好多元气美少女😍管不住点击关注的手😍虽然也爱看阳光小帅哥但是在美少女主页停留的时间更长😍女孩子关注爱看漂亮女孩子这很正常吧😍女孩子爱看泳衣美少女这很正常吧😍就算不正常也没事反正我是怪宝宝😃,1714062008,0,21,0,0,0,0,5
1,想问问留学申请需要用到的grading system（成绩等级转换表）我们学校有现成的吗，还是需要自己制作然后找人盖章呢？🥸🥸,1730127903,1,321,0,0,0,0,4
0,她解开第一层衣服的纽扣她解开第二层衣服的纽扣她解开第三层衣服的纽扣她解开第四层衣服的纽扣在最里层贴近腹部的地方掏出一个塑料袋，慢慢打开几张零钞，脏污但匀整这个卖毛豆的乡下女人在找零钱给我的时候一层一层地剥开自己就像是做一次剖腹产抠出体内的命根子——王单单,1720889195,0,837,0,0,0,7,0
2,求周一下午1：20-4：10有偿代课，女，思政课，私v: z18983023852,1711279488,0,123,0,0,2,0,3
4,有没有人和我一样吃完饭必须用牙线的......今天在外面牙线用完了，真的崩溃,1727326045,0,496,0,0,0,4,1
11,真好啊大三还上30分的课表 太美丽了,1719800853,4,1041,0,0,0,3,5
2,大一，想做与乡村振兴有关的大创项目，捞捞小朋友,1705063417,0,687,0,0,0,0,6
0,笑晕 有的人真不愧是一对,1707582845,1,166,0,0,0,0,5
4,想了解一下今年的就业形势。我将于6月26日发布统计结果。https://www.wjx.cn/vm/OLDPQDB.aspx,1719117845,4,844,0,0,1,2,4
0,友友们，如果想要读应用统计的研究生，实变函数建不建议选呀？,1735022152,6,28,0,0,0,0,4
4,现在怎么随便一个岗位都要硕士。我一直以为这些岗位本科就能干,1711086145,2,1657,0,0,0,2,1
25,1.请问我辅修会计最后得到的学士学位，企业广泛认可吗？    2.我未来可能会搏一搏选调生，请问我辅修的会计可以报名选调吗？    3.辅修学士学位和主修学士学位证书有什么不同，是一致的还是会体现辅修两个大字笨人好迷茫，转不了专业就不知道怎么办了啊啊啊啊啊呜呜呜，大一上,1705139987,3,3871,0,0,2,1,4
