comment_sum,content,create_time,dun_num,hot,jinghua,jubao_count,topic_id,zan_sum,label
0,出英文版国际贸易国际金融 习题 考试 电子书 模拟题出货币银行学电子书习题（英文版）请联系扣扣1983279585,1708840524,0,4,0,0,0,0,3
0,收经管类高数答案书，今天/明天就要,1726301325,0,76,0,0,15,0,6
6,哈哈哈哈校圈又搞了个啥，好好笑,1716106936,0,1686,0,0,0,0,5
1,70多个网球，比赛球打完比赛闲置了，适合初学者拿来喂球、练多球，5块钱出了，财大校园内自取。短信联系：19916598630（短信不是wx）,1710048548,0,531,0,0,3,0,3
0,50r出24年最新CFA一级高顿网课录播，里面还包括了notes/官方书籍电子版因为从别人那里买的时候有点贵想回回本🥲要考的uu们可以看看，可以走闲鱼交易+q：3569749473,1712831213,0,12,0,0,0,0,1
10,搞不懂为什么让盖浇饭窗口的阿姨重新打一份盖浇饭这么难，你放在那儿的都冷了，米饭也硬硬的，让换一份热的，这不是很正常的诉求吗,1727843110,1,1737,0,0,0,5,1
0,想问问外保的同学们 科研这部分是怎么做的呢 已经大三了但是完全没有科研经历 不是商科,1729147438,26,432,0,0,0,0,4
0,毕业便宜出收纳闲置 v：w2hxue,1719827125,0,190,0,0,0,0,3
15,感谢第五人格让我的生活规律起来了🥰早上起来学习中午打两小时第五排位😍下午学习晚上打两小时第五排位😍剩下俩小时爱做什么做什么十一点半美智子睡觉准备第二天重复运行,1720189467,0,444,0,0,0,3,5
2,坐在人群里在听音乐节，旁边有个人问我觉得好听吗，我点头，她“啊？”了一声，好像很无语。咋滴啦，好听啊,1714219552,0,2065,0,0,0,3,4
2,有没有电影推荐,1704107230,3,420,0,0,0,0,4
0,真的不知道什么魔力，回家之后睡的比在学校还晚但是黑眼圈就这样水灵灵消失了,1727885922,0,81,0,0,0,2,5
3,你知不知道我已经把中秋假期的出游计划退掉了为了你的社团招新，结果现在又改时间了我票也买不到了人也约不到了我好无语啊啊啊,1726284772,0,1021,1,0,0,12,1
55,如何呢🤣,1728366782,0,2136,0,1,0,7,5
0,图书馆一楼存包柜东西被清不在商务中心的话还有可能在哪里😭,1713746388,2,150,0,0,0,0,0
0,求gcl老师财政学试卷,1735043337,0,79,0,0,0,0,6
8,大早来占座，本来美美学习，结果对面来了个翻书摔笔姐，又不忍心换座，我咋这么倒霉，破防了。小姐姐你真的贱贱哒。,1718518327,0,1096,0,0,0,6,1
3,上下课高峰期走路低头玩手机的人我祝你平安吧,1726636411,0,1024,1,0,0,14,2
0,"【招聘国际象棋教师】公司介绍： 上海头部双语棋类教学机构，线下base徐汇和浦东，线上网校已覆盖北美/英国/澳洲学员工作时间灵活，不坐班，无课可在家办公；工资面议，五险一金，福利待遇好海外赛事补贴等；扁平化年轻创业团队，工作氛围轻松，成长曲线可观。长期居住在上海本地者优先、英文专业或者海外交换游学经历优先工作时间：周中晚上/周末 每节课课时：90分钟工作地点：上海市徐汇区（南丹东路）/上海市浦东新区（碧云路）岗位职责：  负责国际象棋课程的授课，完成教学时长； 配合课程顾问开展试听课、体验课、比赛日等市场活动；批改学员作业，积极同家长沟通。任职要求： 长期居住在上海，热爱教育事业，专业知识扎实,有亲和力,语言表达能力强，具备团队协作意识和客户服务意识;有国际象棋教学经验者优先!；英文及师范专业毕业或有国际象棋相关等级证书者优先！有意向者邮箱发送你的简历至邮箱：lishenyue3488@163.com简历必填项：1. 基本情况：教育经历、工作经历或者社团活动经历2. 国际象棋：国际象棋级别、赛事名次、是否有相关教学经历3. 英文水平：是否有大学四级或者六级英文水平或者其他英文证书？4. 对自己期待月薪资是多少？（兼职可填写期待时薪）",1712670791,0,18,0,0,1,0,3
0,周三下午1.20-4.00上课，男生。价格可议,1734456497,0,90,0,0,14,0,3
3,放烟花是怎么放的？,1704935125,0,634,0,0,0,1,4
0,今天好开心 坐了两个多小时地铁去交大听lvmh的宣讲会 然后领到了伴手礼,1730902461,0,178,0,0,0,2,5
12,我真服了个人外事…到底出不出了还,1705377012,5,2599,0,0,0,3,1
2,还在睡？真当自己是阔家少爷大小姐 都给我起床 这里是中国 睡洋觉的给我爬 我正在耕地 看得我 直接把驴踢一边去了 自己耕了二亩地 我锄头都要挥冒烟了 要有多余的时间我还去锻炼身体跑步呢,1723123689,0,238,0,0,0,4,2
3,有偿求王悦老师的管理会计期末试卷或相关复习资料～,1733791714,1,175,0,0,0,0,6
11,忘不了高中喜欢的男生怎么办 上一次见面甚至还是在高考期间 ,1729443821,0,925,0,0,0,1,0
0,有五个免费吃面🍜的名额，还是上次那家店！！50元内老板报销转账，需要带图写好评，上次加了没有通过的还可以再加一下🥳🥳仅限五个名额！,1714040194,0,19,0,0,0,0,5
0,大家有没有学姐学长选过朱祎老师的证券投资学呀 想问些事情 微信：yyh4999 谢谢谢谢谢！有偿！祝大家新年快乐～🎆,1704197934,0,6,0,0,0,0,5
38,一起迎接没有挂科的成绩表！我接！,1704933571,0,1947,0,0,0,23,5
1,大学生室内充场有人干过吗，可靠吗,1709909094,3,405,0,0,0,0,4
0,"带教人很好～～～工作很简单～～～饭也很好吃哈哈全球高管咨询公司 Egon Zehnder招聘财务实习生 About Egon Zehnder Since 1964, Egon Zehnder has been at the forefront of defining great leadership in the face of changing economic conditions, emerging opportunities and evolving business goals. With more than 600 consultants in 64 offices and 36 countries around the globe, we work closely with public and private corporations, family-owned enterprises and non-profit and government agencies to provide board advisory services, CEO and leadership succession planning, executive search and assessment, and leadership development. Website： http://www.egonzehnder.com Position： Finance Intern Job Responsibility: Issue VAT fapiao and reconcile input & output VAT with tax bureau system Prepare payment request document and expense reimbursementSupport document preparation for foreign exchange settlement Assist the team in document filling and other initiatives Requirements: 2-3 days per week Major in Finance or Accounting Must be computer literate, with Excel skillsWilling to have can-do attitude Quick learner and good team player Bachelor/Master candidate from a top university, graduating in 2025 or 2026 Address: No.8 Gao An Road, Xu Hui District, Shanghai 上海市徐汇区高安路8号，地铁10号线上海图书馆站或者1号线衡山路站Allowance: RMB 200/day Tax before Provide lunch box 简历请以“Intern-学校-年级-姓名-每周实习天数-可以实习时间”为标题投到jasmine.wei@egonzehnder.com ",1727144703,0,369,0,0,0,0,5
0,再发一遍🥳斑鸠老师专门开了小号加校圈的宝宝们🛰️号banjiulaoshi欢迎找我聊😃,1716604019,0,21,0,0,0,0,5
3,三食堂麻辣烫是不是没了。。只看到多了麻辣香锅。。悲,1725533096,1,952,0,0,0,2,0
2,打个羽球也是打出crush了真是神奇😇,1711128209,0,1044,0,0,0,3,5
2,法学院的学长学姐们，请问一下大一下转专业那个时间能从经济法班转去英美法班吗？或者之后还有啥机会吗？🙏🏻,1709291202,2,436,0,0,0,2,6
3,收书🥹尤其概率论！！感谢🥹,1725782092,0,261,0,0,0,0,5
1,问问大家数模校内赛怎么参加呀？,1713706366,2,378,0,0,0,0,4
14,四月以后到放假学校的二课活动能凑满一分吗，大四生感觉要补不完二课了,1708740260,0,1192,0,0,0,0,1
3,间歇性讨厌身边那些走得近的人,1728026071,0,571,0,0,0,2,2
9,不看了我要打第五,1713282829,0,394,0,0,0,0,6
0,公主们有没有漂亮日抛推推,1717484627,0,37,0,0,0,0,6
1,有借有还 再借不难,1713055110,0,216,0,0,0,1,3
7,会计学选择题喝多选如何复习 会计分录背的差不多了 但是选择题感觉还是不会😭😭,1734513219,2,744,0,0,0,0,0
1,求统计学第二次作业答案，放心仅做参考，10道题的，求求了，带价来都可以商量,1712326425,0,364,0,0,15,1,6
16,🐱：上错菜了💢,1720972972,0,540,0,0,0,1,2
4,诶🤓☝🏻全上海的学校都不如我们财大的时间管理，只要我们的课上到四点钟就可以规避橙色高温了，这些学校的学生停训真是亏大发咯,1724391616,0,1326,1,0,0,34,5
12,冷到发抖 冷到胸腔都在抖 冷到四肢都酸了,1734449569,0,600,0,0,0,3,0
0,哪位同学买的中国文学史习题集，如果看到了可以来认领一下直接找我拿（我的短信和菜鸟app都收到了取件信息，取了拿回来才发现东西不是我的，应该是快递或者驿站把号码信息搞错了……应该明天拿回驿站，看到这条可以直接找我拿走）,1731325055,0,97,0,0,1,0,3
0,uu们，求求评价一下高建军老师的投资科学,1708314667,2,73,0,0,0,0,6
0,高价💰求严jq老师政治经济学资料，作业答案、试卷均可，➕Q：2635641992,1712369166,0,24,0,0,0,0,6
3,每日九宫格（ᵍ）——深度学习🤔,1721262406,0,547,0,0,0,3,4
7,图书馆怎么预约借书啊t.t,1730561642,0,375,0,0,0,0,0
0,这两天理发店开门吗～人多吗～,1717860936,0,106,0,0,0,0,4
0,每天吃得也不少还是饿饿饿饿饿,1717581549,0,97,0,0,0,0,1
3,发言的学生代表真的是个很好的同学😢😢😢他平时也完全没有稿子里面体现的那些东西😢😢😢大家补药再说他了啊😢他只是一个喜欢看牛杂的搞笑男😢😢😢,1725239487,0,1747,1,0,0,38,0
2,今天原本想去献血的，但是最近姨妈不规律，又得等下学期😔,1733126348,0,546,0,0,0,1,1
0,得物长期任职~岗位：国际事业部商品中台运营岗位职责：1、负责线上商品管理、周期数据统计以及异常问题归因并及时根解；2、熟悉商品展示逻辑，梳理并挖掘商品信息质量问题，从中总结出规则与经验使其产品化；3、基于国内外购物网站等多渠道信息来源，不断优化完善平台商品信息质量任职要求：1、本科学历及以上，24或25届毕业生；2、热爱时尚，对于潮流服饰感兴趣，关注市场流行趋势与风向；3、有良好的沟通能力，思维清晰，认真负责，注意细节；4、有较强的数据sense，熟练运用SQL；5、具备一定的计算机思维，能够在引导下独立撰写代码,1734592979,0,3,0,0,0,0,3
1,I think I'm really falling in love，多么强烈爱的感觉，想必是因为你流着和我同样的血，I think I'm really falling in love，多么遗憾今生无缘，我很愿意等着你，下辈子再来到我的世界。,1718514149,0,109,0,0,0,0,5
1,英语模块三像英语学习的奥秘这样的课修了，还需要再修二外或者听力吗,1725608552,0,237,0,0,0,0,4
2,交头接耳,1720954699,0,525,0,0,0,4,4
7,华泰柏瑞营销岗算三中一华实习吗,1727327776,3,777,0,0,0,0,3
0,图书馆里一直像猪一样吸鼻子的人真是不礼貌,1728477941,0,175,0,0,0,0,2
10,说句最难听的 连绩点细化都做不到。经管机编个match函数就解决的事情。为什么我还要感谢你这煞笔教务处的不作为？,1719222473,1,2056,1,0,0,30,2
0,英文财会有什么推荐的网课吗😭中文也可以😭😭求求,1709167710,4,141,0,0,0,0,0
4,还没表白就被拒，我是什么很烂的人吗,1714491136,1,688,0,0,0,0,1
0,生命进化论出分请踢踢我,1720595801,5,171,0,0,0,2,6
4,第三轮选课的系统什么时候会刷新啊，孩子不小心把专业课给退了，上面显示人数已满不能再选了😭😭,1719849948,0,876,0,0,2,0,0
0,求助🥹有没有人见到过这个卡！装在卡套里面的 这对我很重要 应该就是昨天或者前天丢的 捡到的宝宝有偿 加v selinaliu2004,1715493834,0,273,0,0,0,1,1
0,想问问信管电商的学长学姐们是如何规划的，如果不润的话，以后工作能从事的会不会受限,1706974738,5,217,0,0,0,0,4
3,一觉醒来后无所事事 全身瘫软 感觉心情很烦躁,1728028805,1,216,0,0,0,0,0
0,摸脚今天面谈了，女生要求公开赔偿老师居然说这个不是很合适😅最多只能当面道歉+企微课程群道歉，这样子压吗，以及还谈论到不允许以后再发校圈谈这件事,1729219712,0,19,0,0,0,0,1
5,是谁想的9月2号早上七点集合的😅😅😅孩子你无敌了，懒得喷,1725193386,0,1255,0,0,0,9,2
1,英语期中机考大概是什么样子啊不能在纸上圈画有点难受,1731244967,0,261,0,0,0,0,4
2,求问怎么看经管机的网课啊，就是说bb没有回放，孩子缓考怎么复习,1720946110,1,645,0,0,0,1,4
13,好奇转专业的人保研怎么认定？第一学期绩点一起算吗？,1720758986,2,1938,0,0,11,4,4
0,米哈游秋招&amp;校招！有内推码&amp;🐧群我是本次上海财经大学米哈游招聘校园大使ヾ(๑╹ヮ╹๑)ﾉ”有同学对米哈游感兴趣吗！,1721992823,0,3,0,0,1,0,5
3,手机还得是考试前最好玩是真的。。,1720440772,0,403,0,0,0,3,5
0,还给我我的上床上桌🤡🤡🤡想抓人来和本王双人游戏 特么都找不到地方屁股落座。,1709829174,0,294,0,0,0,0,1
14,今天，2024年12月26日是伟大的人民领袖毛泽东同志诞辰131周年！,1735211344,0,1710,1,1,0,74,6
0,半夜想起又心痛，人赚不了自己认知以外的钱,1734628025,0,78,0,0,0,0,0
11,好想tla啊😣好想有个人每天陪我一起去tsg一起吃饭一起说话一起贴贴😭,1718299122,1,975,0,0,0,3,6
1,有没有滴水湖的研究生学长学姐，想咨询一些问题，可以有偿🥺,1728213427,0,280,0,0,0,0,6
2,请问大家人数少于10人的课会开课吗？正态分布会受影响吗？,1725691677,0,633,0,0,0,0,4
2,不会管孩子😭家里小弟弟偷偷往游戏里充了1000+，和他讲道理又撒谎，弄特别麻烦的流程申诉，父母让我管管然后就甩手不管了。每次回家都要唱黑脸，现在的结果就是他只害怕我，但是我一走就原形毕现，每次回家必气氛严肃吵一大架，然后第二天不想气氛尴尬就要精神分裂一样恢复正常。这样的家庭关系应该怎么处理。。,1720184404,0,670,0,0,0,0,0
3,对家flop了笑的我想到处发,1731322386,0,183,0,0,0,0,5
0,↑↑↑代 刷 断看我！！！Oi !Oi！Oi！（猛拍肚皮）Oi !Oi！Oi！（猛拍肚皮）Oi !Oi！Oi！（猛拍肚皮）Oi !Oi！Oi！（猛拍肚皮）Oi !Oi！Oi！（猛拍肚皮）Oi !Oi！Oi！（猛拍肚皮）Oi !Oi！Oi！（猛拍肚皮）Oi !Oi！Oi！（猛拍肚皮）Oi !Oi！Oi！代 刷 断 看我！！！Oi !Oi！Oi！（猛拍肚皮）O i!Oi！Oi！（猛拍肚皮）Oi !Oi！Oi！（猛拍肚皮）Oi !Oi！Oi！（猛拍肚皮）Oi !Oi！Oi！（猛拍肚皮）Oi !Oi！Oi！（猛拍肚皮）Oi !Oi！Oi！（猛拍肚皮）Oi !Oi！Oi！（猛拍肚皮）Oi !Oi！Oi！,1729588139,0,1,0,0,0,0,5
2,选课系统转圈1分钟才进去😅 输了😭,1719801747,1,522,0,0,0,1,1
2,笑死，大白天喝酒/:beer,1720260998,0,366,0,0,0,0,5
0,投资学吃生豆角去吧😄,1730121108,1,283,0,0,0,1,5
8,石榴花让人🤮,1713069996,0,796,0,0,0,0,2
2,收周冏或者谭群辉老师的马原，价格你定,1709174632,0,280,0,0,0,0,3
0,💰收英文中宏笔记/试卷/网课,1708256295,0,18,0,0,0,0,3
1,你不特别，你和我认识的男的都一样，你给我一种谄媚感，很庸俗的感觉，没读过几本书却很痛苦，我听过很多人说自己孤独，但我觉得你的孤独不是真正的孤独。感觉你的内心深处一直都只有你一个人，因为你没有什么特别之处，却以为自己怀才不遇。你想要过度的东西，你想要别人说我懂你，你想要情绪的烈火炙烤你的灵魂，你想要理想化的爱情，现实是白天伪装成没有瑕疵的女性主义者和女孩聊伍尔夫，聊波伏娃，夜晚在某社交平台留言小姐姐看看腿。你给我的感觉就像你记住了很多人名，张口尼采加缪闭口卡夫卡萨特，没人会因为你的人名主义爱你，人们只觉得你装。很多时候我完全不想去了解你，我只觉得你的外界有一层怨天尤人的气息，我懒得打破。,1713161917,0,213,0,0,0,0,2
3,认清一个人的成本好高,1713545141,1,729,0,0,0,4,1
8,请问附近哪里有高楼啥的上面能上去，想拍个视频,1724308114,0,909,0,0,1,0,6
3,原来，小人物，也会感到孤单的！寂寞😞的时候，体温竟真的会下降,1727614343,0,300,0,0,0,1,0
30,宝宝们刷锻到底几点截止哇😯我记得老师是说10点 但是怎么校圈的老师有说是6点的🫨🫨汽水宝宝还要帮朋友🏃🏻‍♀️呢,1716536922,0,1438,0,0,0,2,4
0,果然困的时候不适合学习😭做了篇英语阅读，五道题错了四道🥹,1731998546,0,192,0,0,0,4,0
0,出卫生保健完整版期末题库➕复习资料,1715082797,0,61,0,0,0,1,3
0,有没有同学拼可口雪碧芬达无糖,1722043391,0,193,0,0,0,0,6
23,今天偷偷开🎁了几个人 嘻嘻☺️,1730379584,0,2940,0,0,0,4,5
2,政经、线代这些书以后还会用到吗，纠结要不要出,1708843538,1,559,0,0,0,0,4
5,为什么学校电动车很多都被贴上了数字？,1710733119,1,1468,0,0,0,0,4
3,求问大家ryc的会计信息系统和rxh的中国税法与筹划选哪个比较好啊,1726200307,5,352,0,0,0,0,4
2,想把从6点20开始每10分钟手机闹铃响一次自己还不起起了之后不停哼歌还跑调的室友狠狠橄榄🌚🌚,1724541004,0,736,0,0,1,3,2
8,真心发问：三食堂有什么好吃的早饭？最好不要有很多油的味道大的，早上吃不下油腻的东西😭,1709443478,3,778,0,0,0,0,4
4,挂了两门数学对考研复试有影响吗，是不是c9都不用考虑了啊,1704380875,4,1752,0,0,0,3,1
2,这个应援好好玩哈哈哈哈,1723120340,0,480,0,0,0,1,5
2,在读生9.8一定要来学校刷个脸报道吗  可不可以9.9正式上课了再来啊,1725539897,3,1015,0,0,0,0,4
2,这几天打第五人格打得我想吐。。,1711877749,0,208,0,0,0,0,2
0,有人想去吃小马烧烤嘛，晚上吃过饭了就是猪瘾犯了👿10min内有的话就一起😍😍😍,1728131252,0,49,0,0,0,1,5
1,校内辅修暑假上课吗,1716455805,2,493,0,0,0,0,4
0,收个小电驴😭😭😭,1725183638,0,70,0,0,0,0,0
0,天呐，回归分析是一点不会做，想鼠,1712574050,0,15,0,0,0,0,0
0,感觉可以被新食堂的拌面噎死🤣以后一定记得买饮料🥤,1717390684,1,271,0,0,0,1,5
9,想知道大家不想要了的衣服都怎么处理了😞挂咸鱼也没人鸟我 直接扔又有点心疼,1730699989,0,694,0,0,0,0,0
1,淘淘一般几点开,1727605981,0,178,0,0,0,1,3
1,迁户口是只能大一刚来那会迁吗🥲😇,1706537938,1,712,0,0,0,0,4
0,渣小暖真的好吃😋不是广子,1715706976,0,321,0,0,0,0,5
0,突然想到三中一华有一半都折戟于xhs📕了🤔一些地狱笑话有（不是）,1726903424,1,28,0,0,0,0,4
5,入。为什么、要、长大。,1730073580,0,117,0,0,0,0,0
2,实习三个月了，公司的饭第一次这么好吃😋,1725940792,0,816,0,0,0,1,5
1,#白菜的美好生活还好地铁上没座位不然坐着两眼一闭一睁就到苏州了。,1723076472,0,244,0,0,0,2,5
0,别致敬演出了,1728986251,0,78,0,0,0,0,2
4,为什么新生都在求开学英语往届题目啊，这个也不会有人有吧,1724836227,0,1362,0,0,0,3,4
0,金杰活了！！金杰活了！！,1730110928,0,303,0,0,0,0,5
2,受不了了伪人队友 我要拿大棒球把他们全部肘晕,1722924056,0,364,0,0,0,0,2
9,我室友的三大美德：其一，早起且猛拉抽屉，插拔插座，踹柜子，倒腾塑料袋，翻箱倒柜，让室友睡无可睡，督促起床；其二，东西堆满地，遍地是鞋无从下脚，道路被堵水泄不通，滋养蟑螂，督促室友打扫卫生；其三，半夜不睡与人煲粥，永不熄灯，督促室友好好学习，不懈怠。经此四年，我将成为勤劳的女仆，感谢室友,1713856300,0,1960,1,0,0,12,2
2,mmy博弈论有什么推荐的网课吗，听不懂英文😭马上考试了真的要完蛋了,1732074506,0,252,0,0,0,0,0
0,武川有需要上门独卫保洁的吗，打扫标准很高，不怕脏不怕味儿，黄垢也给你清除，有自带专业的清洁工具,1730005831,0,3,0,0,1,0,3
0,求帮忙代刷二课（讲座），一次30，最好可以长期帮忙刷，多刷更好v：I0516Uxi,1726589419,0,9,0,0,0,0,3
0,出课 模块五  心理学与生活 模块一  红楼梦（龚敏） 模块三  京昆剧赏析需要的可以留个vx我加你～,1708850385,0,82,0,0,0,0,3
0,上财宝宝看过来[嘿哈]新东方招募校园经理人啦！线上灵活办公，薪资+实习证明在校大学生均🉑,1733795243,0,1,0,0,0,0,5
1,各位24级的小盆友们大家好呀！我们是第38届校学联的学术项目组～作为一个专业的学术机构，我们是全学联最具有学术氛围的一个部门哦～在我们这里，你可以在讲座中遇见诺贝尔经济学奖得主！你可以在举办讲座的时候不断提升自己的能力水平，邀请喜欢的教授来给你答疑解惑！你还可以添加许多教授的微信，相信你可以遇见那个对你产生重大影响的人生导师！你可以与复旦交大的学术机构一起合作，共同融入上海高校的浓厚的学术氛围！你还可以参加各种各样的欢乐活动，我们这里有拿不完的学术二课和丰富的志愿者二课！我们这里学霸云集，大家一定会碰到自己志同道合的好友，共同进步！！！欢迎加入我们学术大家庭：扫描问卷下方二维码加入我们吧，记得填写第一志愿哦～你还可以找到许多志同道合的好友,1723764651,0,405,0,0,1,0,5
0,家教找继任家教地址：普陀区中潭路100弄232号，3号线18分钟到达辅导科目：作业辅导，每天把小学作业写完就行学员情况：男生，六年级时间安排：每周5次，每次2小时，周一到周五老师要求：男女老师不限，有家教经验，有耐心，有责任心，一对一上门辅导薪水：100/小时联系方式：cy2510732217,1710680537,1,294,0,0,0,0,3
5,家里的经济支柱失业了...在这种大环境下真地压力爆炸了呵呵呵,1719547841,1,726,0,0,0,0,0
3,金院大二下24.5没有水课会不会很累...,1704684342,5,1149,0,0,0,0,4
0,有没有人有之前在武川门那边买菠萝凤梨和水果的叔的微信🥹求推,1732441122,1,97,0,0,0,0,6
4,黑巧真难吃，怪不得健身人士喜欢，一小块能吃半天,1722040897,0,703,0,0,0,1,2
1,远离内耗的人吧,1729839238,1,250,0,0,0,5,2
0,欧莱雅气垫的团！有人要拼拼吗🥺,1713886164,0,18,0,0,0,0,6
4,四大审计的工作难度算大还是小？实习的时候看姐姐们手指飞花做底稿，我不得不唏嘘了一下我的电脑操作水平。要真让我干审计，我咋觉得我还干不了呢😂,1729601446,10,1024,0,0,0,1,4
0,和平精英比赛参加了就能免15km，在这周五晚上八点，因为免段满了，有没有想参加的可以加我wx：13381869885,1715151910,0,12,0,0,0,0,3
1,求财大附近缝补衣服拉链的地方,1734247144,0,151,0,0,0,0,3
2,Omg瘾君子今天一日三餐只花了28！！！！早餐起晚了：粥＋菜包中餐：12晚餐：14Amazing,1729157193,0,318,0,0,0,4,5
0,收loop跳绳 ＋v18721674137,1713160209,0,13,0,0,0,0,3
0,做过四大或者想了解四大的看过来，Yahoo！,1730815390,0,0,0,0,0,0,5
3,我要给全世界安利他们家的小炒黄牛肉😋😋😋😋😋😋😋😋😋😋😋😋,1734264240,1,688,0,0,0,2,5
0,考研的经济学的专业课难度更接近中微还是微经,1708566764,4,172,0,0,0,0,4
7,在图书馆崩溃地自学高数，，感觉如果高中老师是日复一日追着你把你的嘴扒开把食物喂进去的话，那大学老师就是快速随意地把一小部分食物渣渣扔在地上然后要你自己去捡，吃不饱就自己出去捕猎，但是你初来乍到根本没有什么捕猎技巧，还得摸爬滚打。,1728649206,0,763,0,0,0,9,1
0,早下班的人先享受世界,1718700828,0,126,0,0,0,1,5
4,大家线代多少啊 我低得崩溃 怎么会比高数还低,1720057514,4,1011,0,0,0,0,0
6,学校勾石门禁什么时候能升级？？？没钱能不能别开学校上海财专？？？学校勾石门禁什么时候能升级？？？没钱能不能别开学校上海财专？？？学校勾石门禁什么时候能升级？？？没钱能不能别开学校上海财专？？？学校勾石门禁什么时候能升级？？？没钱能不能别开学校上海财专？？？学校勾石门禁什么时候能升级？？？没钱能不能别开学校上海财专？？？学校勾石门禁什么时候能升级？？？没钱能不能别开学校上海财专？？？学校勾石门禁什么时候能升级？？？没钱能不能别开学校上海财专？？？学校勾石门禁什么时候能升级？？？没钱能不能别开学校上海财专？？？学校勾石门禁什么时候能升级？？？没钱能不能别开学校上海财专？？？学校勾石门禁什么时候能升级？？？没钱能不能别开学校上海财专？？？,1715102109,0,1126,0,0,0,3,1
17,一天天突如其来的💩意真的很冒犯到我 能不能尊重一下我的感受 不是每次都有时间去拉你 我也有我的生活好吗,1710302463,0,2055,0,0,0,13,2
0,more nerds🤓,1720703246,0,84,0,0,0,0,2
